{
  "name": "scroll-area",
  "type": "component",
  "description": "Scrollable region with a styled, themed scrollbar.",
  "category": "Layout",
  "dependencies": {
    "components": [],
    "js": [],
    "composer": ["gehrisandro/tailwind-merge-laravel"]
  },
  "files": [
    { "path": "scroll-area.blade.php", "source": "files/scroll-area.blade.php" }
  ],
  "tailwind": {
    "cssVars": ["--border", "--muted-foreground", "--ring"],
    "notes": "Native overflow, no JavaScript and no synthetic scrollbar. Set a height or max-height via `class` or nothing scrolls. Orientations: vertical, horizontal, both."
  }
}
