{
  "name": "navbar-01",
  "type": "block",
  "description": "Classic top navbar with centered links, a dropdown, and dual call-to-action buttons. Collapses into a slide-in sheet on mobile.",
  "category": "Navbar",
  "dependencies": {
    "components": ["button", "collapsible", "dropdown-menu", "sheet"],
    "js": [],
    "composer": ["gehrisandro/tailwind-merge-laravel"]
  },
  "files": [
    {
      "path": "blocks/navbar-01.blade.php",
      "source": "files/navbar-01.blade.php"
    }
  ]
}
