{
  "name": "navbar-10",
  "type": "block",
  "description": "Navbar with a mega menu laid out as a two-column grid of icon, title, and description items. Mobile menu uses an expandable sheet.",
  "category": "Navbar",
  "dependencies": {
    "components": ["button", "sheet"],
    "js": ["alpinejs", "@alpinejs/focus", "@alpinejs/collapse"],
    "composer": ["gehrisandro/tailwind-merge-laravel"]
  },
  "files": [
    {
      "path": "blocks/navbar-10.blade.php",
      "source": "files/navbar-10.blade.php"
    }
  ]
}
