{
  "name": "navbar-05",
  "type": "block",
  "description": "Compact navbar with a two-group mega menu and a footer call-to-action row inside the panel. Mobile menu uses an expandable sheet.",
  "category": "Navbar",
  "dependencies": {
    "components": ["button", "sheet"],
    "js": [],
    "composer": ["gehrisandro/tailwind-merge-laravel"]
  },
  "files": [
    {
      "path": "blocks/navbar-05.blade.php",
      "source": "files/navbar-05.blade.php"
    }
  ]
}
